id,front,back,example
147,traditionnel,Fondé sur des coutumes et des pratiques établies de longue date.,La mondialisation a remis en question les valeurs traditionnelles et les identités culturelles dans de nombreuses sociétés.
148,transformer,Changer complètement la forme ou la nature de quelque chose.,Les technologies numériques ont le pouvoir de transformer la façon dont les gens travaillent et communiquent.
149,s'orienter,Une direction générale dans laquelle quelque chose évolue.,La tendance mondiale à l'urbanisation ne montre aucun signe de ralentissement dans les décennies à venir.
150,urbain,Relatif à une ville ou caractéristique d'une ville.,Le développement urbain rapide a exercé une pression énorme sur les infrastructures de transport public.
151,valeur,L'importance ou la valeur attribuée à quelque chose.,Des valeurs fondamentales telles que l'égalité et la justice sous-tendent la plupart des constitutions démocratiques modernes.
152,varier,Être différent ou changer en fonction des conditions.,L'espérance de vie varie considérablement d'un pays à l'autre en fonction du revenu et de la qualité des soins de santé.
153,victime,Une personne lésée par un crime ou un malheur.,Des systèmes de soutien adéquats doivent être mis en place pour aider les victimes de violence domestique à se rétablir.
154,bien-être,"La santé, le bonheur et le bien-être d'une personne.",L’État-providence offre un filet de sécurité aux citoyens pendant les périodes de chômage ou de maladie.
155,accéder,La capacité ou le droit d'obtenir ou d'utiliser quelque chose.,Garantir l'égalité d'accès aux soins de santé est une obligation fondamentale de tout gouvernement juste.
156,adapter,S'adapter à de nouvelles conditions ou circonstances.,Les entreprises doivent s'adapter en permanence à l'évolution rapide des conditions du marché pour rester compétitives.
157,adresse,Aborder ou parler d'un problème.,Les décideurs politiques doivent s'attaquer d'urgence au problème croissant du sans-abrisme dans les grandes villes.
158,adéquat,Satisfaisant ou suffisant pour un usage particulier.,Chaque enfant a le droit de recevoir une éducation et une alimentation de qualité adéquate.
159,agence,Une organisation agissant pour le compte d'une autre ; autonomie.,Une agence gouvernementale a été créée spécifiquement pour superviser les questions de protection de l'environnement.
160,argumenter,Présenter des arguments à l'appui d'une position.,De nombreux économistes affirment que le libre-échange profite aussi bien aux pays en développement qu'aux pays développés.
161,conscient,Avoir connaissance ou conscience de quelque chose.,Les jeunes sont de plus en plus conscients des conséquences du changement climatique sur leur avenir.
162,équilibre,Une distribution égale ou un équilibre stable.,Il est nécessaire d'adopter une approche équilibrée qui favorise la croissance économique tout en protégeant l'environnement.
163,barrière,Un élément qui empêche l'accès ou la progression.,Les obstacles financiers continuent d'empêcher de nombreux étudiants talentueux d'accéder à l'enseignement supérieur.
164,comportement,La manière dont une personne ou un organisme agit.,Les programmes éducatifs peuvent modifier efficacement les comportements et promouvoir des choix de vie plus sains.
165,budget,Une estimation des recettes et des dépenses pour une période donnée.,Les gouvernements doivent consacrer une part suffisante du budget national à l'éducation publique.
166,capital,La richesse utilisée pour générer des revenus ; le siège du gouvernement d'un pays.,Investir dans le capital humain par le biais de l'éducation génère des retours économiques importants à long terme.
167,graphique,Une représentation visuelle des données ; enregistrer les données.,Le graphique illustre une augmentation constante des températures moyennes mondiales de 1980 à 2020.
168,choix,Une sélection effectuée parmi les alternatives disponibles.,Les gouvernements devraient respecter le choix individuel tout en veillant à ce que les citoyens soient bien informés.
169,collecter,Rassembler des éléments ou des informations.,Les chercheurs recueillent des données auprès de milliers de participants afin de garantir la fiabilité statistique.
170,commettre,S'engager ou se consacrer à une ligne de conduite.,Les nations doivent s'engager par des accords contraignants pour réduire significativement leurs émissions de gaz à effet de serre.
171,communiquer,Partager ou échanger des informations efficacement.,La capacité à communiquer clairement et de manière persuasive est essentielle dans la vie académique et professionnelle.
172,rivaliser,Lutter contre les autres pour atteindre le même objectif.,Les nations doivent investir dans l'éducation et l'innovation pour être compétitives dans l'économie mondiale.
173,conflit,Un désaccord grave ou une lutte prolongée.,Les conflits armés continuent de déplacer des millions de personnes dans différentes régions du monde.
174,contracter,Un accord légal formel entre les parties.,Les travailleurs doivent toujours lire attentivement un contrat de travail avant de signer tout document.
175,faire face,Pour gérer efficacement une situation difficile.,De nombreuses communautés peinent à faire face à la fréquence croissante des catastrophes naturelles.
176,corrompu,Malhonnête ou prêt à agir de manière contraire à l'éthique pour en tirer profit.,Les fonctionnaires corrompus qui détournent les fonds publics sapent la confiance que les citoyens placent dans le gouvernement.
177,coût,Le montant nécessaire pour acheter ou faire quelque chose.,La hausse du coût de la vie rend l'accès au logement de plus en plus difficile pour les familles à faibles revenus.
178,crime,Un acte illégal punissable par la loi.,S’attaquer aux causes profondes de la pauvreté est essentiel pour réduire les taux de criminalité violente.
179,crise,Une période de grande difficulté ou de danger.,La crise financière mondiale de 2008 a démontré à quel point les économies modernes sont devenues interconnectées.
180,critique,Nécessitant une analyse approfondie ; d'une grande importance.,La pensée critique est une compétence essentielle pour analyser les problèmes complexes dans la vie académique et professionnelle.
181,diminuer,Diminuer en taille ou en quantité.,On observe une diminution constante du nombre de personnes vivant dans l'extrême pauvreté à l'échelle mondiale.
182,démocratie,Un système de gouvernement par des représentants élus.,Une démocratie dynamique repose sur des citoyens bien informés et une presse libre.
183,détecter,Découvrir ou identifier la présence de quelque chose.,Les outils de dépistage avancés permettent de détecter certains cancers à un stade précoce et plus facile à traiter.
184,maladie,Une maladie causée par une infection ou un dysfonctionnement.,Prévenir la propagation des maladies infectieuses nécessite des investissements importants dans les infrastructures de santé publique.
185,domestique,Relatif à la maison ou à son propre pays.,Les décisions de politique intérieure peuvent avoir des conséquences importantes sur la réputation internationale d'une nation.
186,dominer,Avoir le plus de pouvoir ou d'influence sur les autres.,Un petit nombre de sociétés multinationales dominent le commerce mondial de la production alimentaire.
187,économie,Le système de production et de consommation d'un pays.,La diversification de l'économie nationale réduit la vulnérabilité d'un pays aux chocs des prix des matières premières.
188,émission,La production et le rejet de gaz dans l'atmosphère.,La réduction des émissions de carbone est un élément central des efforts internationaux déployés pour lutter contre le changement climatique.
189,imposer,Pour contraindre au respect d'une loi ou d'un règlement.,"Sans ressources adéquates, les gouvernements ne peuvent pas appliquer efficacement les lois de protection de l'environnement."
190,identifier,Reconnaître ou établir l'identité de quelque chose.,L'étude vise à identifier les principaux facteurs contribuant à la hausse du chômage des jeunes.
191,observer,Observer attentivement ou remarquer quelque chose.,Les scientifiques observent le comportement animal dans leurs habitats naturels afin de mieux comprendre les systèmes écologiques.
192,catégorie,Une classe ou un groupe de choses ayant des qualités communes.,"Le rapport divise les déchets en trois grandes catégories : recyclables, organiques et dangereux."
193,principe,Une vérité fondamentale ou une règle guidant le comportement.,Le principe d'égalité sous-tend le droit international des droits de l'homme et la gouvernance démocratique.
194,publier,Mettre des informations ou des travaux à la disposition du public.,Les chercheurs doivent publier leurs résultats dans des revues scientifiques crédibles pour contribuer à l'avancement des connaissances scientifiques.
195,innover,Introduire de nouvelles idées ou méthodes.,Les entreprises qui n'innovent pas risquent d'être devancées sur le marché par des concurrents plus agiles.
196,intégrer,Combiner ou incorporer des parties en un tout.,Des politiques efficaces sont nécessaires pour aider les réfugiés à s'intégrer dans leurs communautés d'accueil.
197,allouer,Répartir les ressources dans un but précis.,Les gouvernements doivent allouer des fonds suffisants pour maintenir et améliorer les services de santé publique.
198,coordonner,Organiser des personnes ou des groupes pour qu'ils travaillent ensemble.,Les agences internationales doivent coordonner leurs efforts de secours en cas de catastrophe afin d'en maximiser l'efficacité.
199,débat,Une discussion formelle des points de vue opposés.,Les effets à long terme de la mondialisation sur les inégalités font l'objet d'un débat permanent parmi les économistes.
200,exposer,Révéler ou laisser sans protection face à quelque chose.,Les enfants exposés à la violence dans les médias peuvent développer une insensibilité face à la violence.
201,accélérer,Augmenter la vitesse ou le rythme.,L'innovation technologique a accéléré la croissance économique dans de nombreux pays en développement.
202,accommoder,Prévoir de l'espace ou s'adapter aux besoins.,Les villes doivent développer leurs infrastructures pour accueillir la population urbaine croissante.
203,accumuler,Se rassembler ou s'accumuler progressivement au fil du temps.,"Dans les pays développés, les ménages ont tendance à accumuler davantage de richesses au fil des générations."
204,reconnaître,Reconnaître ou admettre l'existence de quelque chose.,Les gouvernements doivent reconnaître le rôle de la pauvreté dans la formation des inégalités sociales.
205,acquisition,L'action d'obtenir ou de gagner quelque chose.,L'acquisition précoce du langage est essentielle à la réussite scolaire à long terme d'un enfant.
206,négatif,Nocif ou ayant un effet défavorable.,Une exposition prolongée à la pollution peut avoir des effets néfastes sur la santé publique.
207,avocat,Soutenir publiquement une cause ou une politique.,De nombreux éducateurs préconisent des classes de taille réduite pour améliorer les résultats d'apprentissage.
208,soulager,Pour atténuer une souffrance ou un problème.,Les programmes d'aide étrangère visent à réduire la pauvreté dans les pays les moins développés du monde.
209,ambitieux,Avoir une forte volonté d'atteindre des objectifs ambitieux.,Le gouvernement s'est fixé un objectif ambitieux : réduire les émissions de carbone de 50 % d'ici 2030.
210,amplifier,Augmenter la force ou l'effet de quelque chose.,"Les réseaux sociaux peuvent amplifier le débat public, mais aussi propager rapidement la désinformation."
211,anticiper,Prédire ou anticiper quelque chose avant que cela ne se produise.,Les décideurs politiques doivent anticiper les évolutions démographiques futures lorsqu'ils planifient les services publics.
212,apparent,Clairement visible ou évident ; qui semble vrai.,Il est évident que l'accès à une éducation de qualité reste inégal selon les classes sociales.
213,attribut,Considérer quelque chose comme étant causé par un facteur.,Les chercheurs attribuent l'augmentation de l'obésité principalement à de mauvaises habitudes alimentaires et à la sédentarité.
214,autonome,"Agir de manière indépendante, sans contrôle extérieur.",Les véhicules autonomes devraient transformer l'industrie mondiale des transports.
215,biodiversité,Diversité de la faune et de la flore dans un habitat.,La déforestation constitue une menace importante pour la biodiversité des forêts tropicales humides.
216,fardeau,Une lourde charge ou responsabilité ; surcharger.,La hausse des coûts des soins de santé représente un fardeau considérable pour les particuliers comme pour les gouvernements.
217,capacité,La quantité maximale qu'un objet peut contenir ou faire.,Les pays en développement doivent renforcer leurs capacités institutionnelles pour lutter efficacement contre le changement climatique.
218,empreinte carbone,Total des gaz à effet de serre produits par une entité.,Les individus peuvent réduire considérablement leur empreinte carbone en adoptant un régime alimentaire à base de plantes.
219,chronique,Persistant longtemps ; récurrent constamment.,Le chômage chronique en milieu rural contribue à la pauvreté généralisée et à l'exclusion sociale.
220,civique,En lien avec les citoyens et leurs responsabilités.,L'engagement civique est essentiel au maintien d'une démocratie saine et fonctionnelle.
221,collaboration,Travailler en collaboration avec d'autres pour atteindre un objectif.,La collaboration internationale est nécessaire pour relever les défis mondiaux tels que le changement climatique.
222,compétence,La capacité de faire quelque chose efficacement.,Les employeurs valorisent de plus en plus les compétences numériques au même titre que les qualifications académiques traditionnelles.
223,conformité,"Se conformer aux règles, aux normes ou aux lois.",Le strict respect des réglementations environnementales est essentiel au développement industriel durable.
224,complet,Y compris tous les aspects ; de manière approfondie et complète.,Une approche globale de la santé publique doit prendre en compte à la fois la prévention et le traitement.
225,contrainte,Une limitation ou une restriction d'action.,Les contraintes budgétaires empêchent souvent les gouvernements d'investir suffisamment dans les infrastructures publiques.
226,consommation,"L'utilisation de biens, de ressources ou d'énergie.",Réduire la consommation d'énergie est une stratégie clé pour lutter contre le changement climatique à l'échelle mondiale.
227,contemporain,Existant ou se produisant au présent.,La société contemporaine est confrontée à des défis sans précédent liés aux technologies numériques et à la protection de la vie privée.
228,controversé,Provoquer de forts désaccords ou débats.,Le recours à l'énergie nucléaire demeure un sujet très controversé dans les débats environnementaux.
229,corrélatif,Pour montrer une relation mutuelle entre deux choses.,Les recherches montrent que des niveaux d'éducation plus élevés sont fortement corrélés à de meilleurs résultats économiques.
230,programme d'études,Matières enseignées dans une école ou un cours.,De nombreux éducateurs estiment que le programme scolaire national devrait inclure davantage de compétences en matière de pensée critique.
231,déboisement,Déboisement à grande échelle par l'homme.,La déforestation en Amazonie est principalement due à l'expansion agricole et à l'élevage bovin.
232,démographique,Données statistiques relatives à un groupe de population.,L’évolution démographique vers une population vieillissante exercera une pression considérable sur les systèmes de retraite.
233,épuiser,Réduire ou épuiser les stocks de quelque chose.,La surpêche continue d'épuiser les ressources marines à un rythme alarmant et non durable.
234,détériorer,Se dégrader progressivement.,"Sans intervention urgente, les conditions environnementales dans les zones urbaines continueront de se détériorer."
235,numérique,Relatif à l'informatique et à Internet.,La fracture numérique entre pays riches et pays pauvres risque d'aggraver encore les inégalités mondiales.
236,diminuer,Réduire ou diminuer son importance.,L'automatisation pourrait réduire la demande de main-d'œuvre peu qualifiée dans les secteurs manufacturiers.
237,divergence,Une différence entre des choses qui devraient correspondre.,Il existe un décalage notable entre les objectifs affichés par le gouvernement et ses politiques réelles.
238,discrimination,Traitement injuste fondé sur l'appartenance à un groupe.,La discrimination au travail à l'égard des femmes demeure un obstacle important à l'égalité des sexes.
239,disparité,Une grande différence entre les choses ou les groupes.,L'accroissement des inégalités de richesse entre les citoyens les plus riches et les plus pauvres menace la cohésion sociale.
240,déplacement,Expulsion forcée des personnes de leur domicile.,Les conflits armés ont provoqué le déplacement de millions de personnes à travers le Moyen-Orient.
241,perturbation,Une perturbation qui interrompt l'activité normale.,L'innovation numérique a profondément bouleversé les modèles commerciaux et les industries traditionnels.
242,dominant,"Le plus puissant, le plus important ou le plus influent.",L'anglais est devenu la langue dominante du commerce international et de la recherche universitaire.
243,sécheresse,Une période prolongée de précipitations anormalement faibles.,La sécheresse prolongée en Afrique subsaharienne a dévasté la production agricole et la sécurité alimentaire.
244,écologique,Relatif aux relations entre les organismes et leur environnement.,Les pratiques agricoles industrielles ont causé de graves dommages écologiques aux sols et aux cours d'eau.
245,accent,Importance particulière accordée à quelque chose.,On accorde une importance croissante au développement des compétences transversales dans les programmes scolaires modernes.
246,épidémie,Une maladie qui se propage largement dans une région.,L'épidémie d'obésité dans les pays riches est liée à la sédentarité et à une mauvaise alimentation.
247,égalité,L'état d'égalité des droits et des chances.,Parvenir à l'égalité des sexes sur le lieu de travail nécessite à la fois une réforme législative et un changement culturel.
248,éthique,Relatif aux principes moraux et à la bonne conduite.,L’utilisation de l’intelligence artificielle soulève d’importantes questions éthiques concernant la vie privée et la responsabilité.
249,dépense,La somme d'argent dépensée pour quelque chose.,L'augmentation des dépenses publiques en matière d'éducation peut engendrer d'importants bénéfices économiques à long terme.
250,exploiter,Utiliser une ressource de manière abusive ou en faire un mauvais usage.,Les entreprises multinationales ont été critiquées pour leur exploitation de la main-d'œuvre bon marché dans les pays en développement.
251,extinction,La disparition complète d'une espèce.,L'activité humaine pousse de nombreuses espèces végétales et animales vers une extinction rapide.
252,faciliter,Faciliter une action ou un processus.,L'amélioration des infrastructures de transport peut faciliter le commerce et stimuler considérablement le développement économique.
253,fiscal,Relatif aux recettes et à la fiscalité publiques.,Les gouvernements doivent adopter des politiques budgétaires prudentes afin d'éviter une accumulation excessive de la dette nationale.
254,flexible,Capable de s'adapter facilement aux conditions changeantes.,Il a été démontré que des modalités de travail flexibles améliorent le bien-être et la productivité des employés.
255,combustibles fossiles,Source d'énergie formée à partir de matière organique ancienne.,La combustion continue des énergies fossiles est la principale cause du changement climatique mondial.
256,fragile,Facilement cassable ou endommageable ; délicat et vulnérable.,"Les petits États insulaires possèdent des écosystèmes particulièrement fragiles, menacés par la montée du niveau de la mer."
257,cadre,Une structure ou un système de base pour guider l'action.,Un cadre juridique clair est nécessaire pour réglementer de manière éthique l'utilisation de l'intelligence artificielle.
258,fondamental,Constituer une base ou un noyau essentiel.,L'accès à l'eau potable est un droit humain fondamental dont beaucoup de personnes sont encore privées.
259,mondialisation,Intégration économique et culturelle mondiale croissante.,"La mondialisation a créé de nouvelles opportunités commerciales, mais elle a également accru la concurrence économique."
260,soins de santé,Fourniture organisée de services médicaux à la population.,"L'accès universel aux soins de santé garantit à tous les citoyens l'accès à des soins médicaux, quel que soit leur revenu."
261,hypothèse,Une explication proposée qui nécessite des tests supplémentaires.,Le chercheur a émis l'hypothèse que l'alimentation influence directement le développement cognitif chez l'enfant.
262,identique,Identiques en tous points.,L'étude a révélé des résultats quasi identiques dans deux groupes ayant des niveaux d'éducation différents.
263,implication,Une conséquence probable ou une signification suggérée.,L'essor de l'automatisation a des conséquences importantes sur l'emploi et la répartition des revenus à l'avenir.
264,incitation,Quelque chose qui encourage une action souhaitée.,Les incitations fiscales peuvent encourager les entreprises à investir dans les technologies des énergies renouvelables.
265,inégalité,Répartition inégale des ressources ou des opportunités.,L’accroissement des inégalités de revenus est l’un des défis sociaux les plus urgents de l’ère moderne.
266,inévitable,C'est certain ; impossible à éviter.,Certains économistes affirment que le chômage technologique est une conséquence inévitable de l'automatisation.
267,inflation,Une hausse générale des prix au fil du temps.,Une forte inflation érode le pouvoir d'achat et touche de manière disproportionnée les ménages à faibles revenus.
268,innovation,"Introduction de nouvelles idées, méthodes ou produits.",L'innovation continue dans le domaine des énergies renouvelables est essentielle à la réalisation des objectifs mondiaux de développement durable.
269,interaction,Action ou communication réciproque entre les parties.,L'interaction en face à face est essentielle au développement des compétences sociales fondamentales chez les jeunes enfants.
270,intervention,Mesures prises pour améliorer ou prévenir une situation.,Une intervention gouvernementale rapide est essentielle pour éviter l'aggravation d'une crise financière.
271,investissement,Allouer des ressources en prévision de bénéfices futurs.,Les investissements directs étrangers jouent un rôle crucial dans l'accélération de la croissance économique des pays en développement.
272,législation,Lois ou ensemble de lois promulguées par le gouvernement.,Une législation plus stricte est nécessaire pour protéger les travailleurs contre les conditions de travail dangereuses.
273,alphabétisation,"La capacité de lire, d'écrire ou d'utiliser une compétence.",Des taux d'alphabétisation élevés sont fortement associés à une meilleure productivité économique et à de meilleurs résultats sociaux.
274,marginaliser,Traiter un groupe comme étant sans importance ou périphérique.,Les politiques économiques qui ignorent les zones rurales ont tendance à marginaliser davantage des communautés déjà vulnérables.
275,mécanisme,Un système ou un processus permettant d'obtenir un résultat.,Des mécanismes de régulation efficaces sont indispensables pour prévenir les pratiques monopolistiques sur les marchés libres.
276,méthodologie,Un système de méthodes utilisées en recherche.,Les conclusions de l'étude ont été remises en question en raison de failles importantes dans sa méthodologie de recherche.
277,migration,Déplacement de personnes d'un lieu à un autre.,L'exode rural économique vers les centres urbains s'est accéléré dans de nombreux pays en développement au cours des dernières décennies.
278,état d'esprit,Un ensemble établi d'attitudes ou de croyances.,Un état d'esprit de croissance encourage les élèves à considérer les erreurs comme des occasions d'apprentissage.
279,mobilité,La possibilité de se déplacer librement entre les positions.,L'éducation est largement considérée comme le principal moteur de la mobilité sociale dans les sociétés modernes.
280,mortalité,Le taux de mortalité au sein d'une population.,L'amélioration des conditions sanitaires a permis de réduire considérablement les taux de mortalité infantile dans les pays en développement.
281,motivation,La raison ou la motivation qui sous-tend l'action d'une personne.,Les élèves dotés d'une forte motivation intrinsèque ont tendance à obtenir de meilleurs résultats que ceux qui sont motivés uniquement par des récompenses externes.
282,municipal,Relatif à l'administration d'une ville ou d'une municipalité.,Les autorités municipales sont responsables de la gestion des systèmes de collecte des déchets et de transport public.
