id,front,back,example
1,atteindre,Réussir à atteindre un objectif ou un résultat.,Les étudiants qui se fixent des objectifs clairs ont plus de chances de réussir leurs études.
2,affecter,Avoir un impact ou une influence sur quelque chose.,La pollution atmosphérique peut nuire à la santé des populations urbaines.
3,analyser,Examiner quelque chose en détail pour le comprendre.,Les chercheurs doivent analyser soigneusement les données avant de tirer des conclusions.
4,approche,Une méthode ou une manière de traiter quelque chose.,Une approche holistique de l'éducation prend en compte les besoins sociaux et émotionnels des élèves.
5,aspect,Une partie ou une caractéristique particulière de quelque chose.,Un aspect essentiel du développement durable est la réduction des émissions de carbone.
6,évaluer,Évaluer ou juger la qualité de quelque chose.,Les gouvernements doivent évaluer l'impact environnemental des nouveaux projets industriels.
7,supposer,Accepter quelque chose comme vrai sans preuve.,On suppose souvent que la croissance économique améliore automatiquement le niveau de vie.
8,attitude,Une opinion ou un sentiment bien arrêté sur quelque chose.,L’opinion publique à l’égard des énergies renouvelables a considérablement évolué ces dernières années.
9,disponible,Utilisable ou pouvant être obtenu.,"L'accès à Internet devrait être garanti à tous les citoyens, quel que soit leur revenu."
10,avantage,Un avantage ou un résultat positif découlant de quelque chose.,L'exercice physique régulier offre de nombreux bienfaits pour la santé physique et mentale.
11,cause,Quelque chose qui produit un effet ou un résultat.,La pauvreté est fréquemment citée comme une cause profonde des inégalités sociales.
12,défi,Un problème ou une tâche difficile qui exige des efforts.,Le changement climatique représente l'un des plus grands défis auxquels est confrontée la société moderne.
13,citoyen,Un membre légalement reconnu d'un État.,Il est du devoir de chaque citoyen de participer aux élections démocratiques.
14,réclamer,Affirmer quelque chose comme une vérité ou revendiquer un droit.,Certains chercheurs affirment que les réseaux sociaux sont néfastes pour la santé mentale des adolescents.
15,classer,Classer les choses par catégories ou groupes.,Les scientifiques classent les organismes selon leurs caractéristiques génétiques et physiques.
16,communauté,Un groupe de personnes partageant un lieu ou un intérêt commun.,Des réseaux de soutien communautaires solides contribuent à réduire l'isolement social chez les personnes âgées.
17,comparer,Examiner les similitudes et les différences entre les choses.,Cet essai comparera l'efficacité des systèmes de santé publics et privés.
18,complexe,Composé de nombreuses parties interconnectées ; difficile à comprendre.,La relation entre pauvreté et criminalité est extrêmement complexe et multiforme.
19,concept,Une idée abstraite ou un principe général.,Le concept de durabilité est central dans la politique environnementale moderne.
20,préoccupation,Un souci ou un problème qui suscite de l'anxiété ou de l'intérêt.,L'inquiétude croissante face à la pollution plastique a incité de nombreux gouvernements à agir.
21,conclure,Parvenir à une décision ou à un jugement après raisonnement.,L'étude conclut que l'exercice physique régulier réduit significativement le risque de dépression.
22,condition,L'état ou les circonstances qui affectent quelque chose.,L’amélioration des conditions de vie dans les zones rurales demeure une priorité pour les décideurs politiques.
23,conduire,Exécuter une activité ; un comportement ou une manière.,L'université mènera une étude longitudinale sur le bien-être des étudiants sur une période de cinq ans.
24,conséquence,Un résultat ou un effet d'une action ou d'un événement.,La déforestation a de graves conséquences sur la biodiversité et les régimes climatiques mondiaux.
25,considérer,Réfléchir attentivement avant de prendre une décision.,Les décideurs politiques doivent prendre en compte les conséquences à long terme du relèvement de l'âge de la retraite.
26,consister,Être composé de parties.,"Un régime alimentaire équilibré doit comprendre des protéines, des glucides, des lipides, des vitamines et des minéraux."
27,consommer,Utiliser une ressource ou manger/boire quelque chose.,Les pays développés consomment beaucoup plus de ressources naturelles par habitant que les pays en développement.
28,contribuer,Contribuer à un effort ou à un résultat collectif.,Le bénévolat peut contribuer grandement au développement personnel et au bien-être de la communauté.
29,contrôle,Réglementer ou avoir du pouvoir sur quelque chose.,Un contrôle gouvernemental plus strict des émissions industrielles est nécessaire pour lutter contre la pollution atmosphérique.
30,créer,Faire exister quelque chose.,L'investissement dans les énergies renouvelables peut créer des milliers de nouveaux emplois dans tous les secteurs de l'économie.
31,culture,"Les croyances, les coutumes et les arts d'une société.",La mondialisation a à la fois enrichi et menacé les cultures locales à travers le monde.
32,données,Faits ou statistiques recueillis à des fins d'analyse.,Des données fiables sont essentielles à l'élaboration de politiques de santé publique efficaces.
33,déclin,Diminuer ou devenir plus petit avec le temps.,Ces dernières décennies ont été marquées par un net déclin de la biodiversité dû à l'activité humaine.
34,définir,Énoncer la signification ou la nature de quelque chose.,Il est important de définir clairement le terme « durabilité » avant d'aborder les solutions politiques.
35,demande,Le besoin ou le désir d'un bien ou d'un service.,La demande croissante de véhicules électriques stimule l'innovation dans le domaine des technologies de batteries.
36,dépendre,Compter sur quelqu'un ou quelque chose pour obtenir du soutien.,De nombreux pays en développement dépendent fortement de l'aide étrangère pour le développement de leurs infrastructures de base.
37,décrire,Décrire quelque chose avec des mots.,Le rapport décrit une augmentation significative des températures moyennes mondiales depuis 1950.
38,développer,"Grandir, progresser ou créer quelque chose de nouveau.",Les pays doivent développer une agriculture durable pour répondre aux besoins d'une population croissante.
39,différence,Une façon dont les choses diffèrent les unes des autres.,Il existe une différence significative de niveaux de revenus entre les populations urbaines et rurales.
40,distribuer,Répandre ou distribuer quelque chose sur une zone.,Les gouvernements ont la responsabilité de répartir équitablement les ressources publiques entre les citoyens.
41,divers,Y compris de nombreux types ou variétés différents.,Une main-d'œuvre diversifiée apporte un plus large éventail de perspectives et d'idées à une organisation.
42,économique,Relatif à la production et à l'utilisation de la monnaie.,Le développement économique rapide a sorti des millions de personnes de la pauvreté en Asie.
43,éducation,Le processus de réception d'un enseignement systématique.,L'accès à une éducation de qualité est largement considéré comme un droit humain fondamental.
44,effet,Un changement ou un résultat produit par une cause.,Les effets à long terme du manque de sommeil sur les fonctions cognitives sont bien documentés.
45,émerger,Apparaître ou se faire connaître.,De nouvelles technologies continuent d'émerger comme solutions à la crise énergétique mondiale.
46,employer,Embaucher quelqu'un pour travailler contre rémunération.,Le secteur manufacturier continue d'employer une part importante de la population active nationale.
47,énergie,Énergie issue de ressources naturelles ou transformées.,La transition vers les sources d'énergie renouvelables est essentielle pour réduire les émissions de gaz à effet de serre.
48,environnement,Le monde naturel ou l'environnement d'un organisme.,La protection de l'environnement naturel devrait être une priorité tant pour les gouvernements que pour les individus.
49,établir,Mettre en place ou créer quelque chose de manière solide.,Le gouvernement a créé un nouvel organisme de réglementation chargé de superviser le secteur financier.
50,évaluer,Évaluer la valeur ou la qualité de quelque chose.,Il est essentiel d'évaluer de manière critique les sources d'information avant de les citer.
51,preuve,Des faits ou des informations étayant une conclusion.,Il existe de solides preuves empiriques liant le tabagisme à diverses maladies graves.
52,examiner,Examiner ou inspecter quelque chose attentivement.,Cet essai examinera la relation entre les inégalités économiques et les taux de criminalité.
53,développer,"Augmenter en taille, en nombre ou en portée.",De nombreuses entreprises cherchent à étendre leurs activités aux marchés émergents d'Asie.
54,attendre,Croire que quelque chose se produira dans le futur.,On s'attend généralement à ce que l'automatisation transforme le paysage de l'emploi d'ici quelques décennies.
55,expérience,Connaissances ou compétences acquises par la pratique.,Les stages en entreprise permettent aux étudiants de développer des compétences pratiques pour leur futur emploi.
56,expliquer,Clarifier quelque chose en le décrivant.,La capacité de la professeure à expliquer clairement des théories complexes lui a valu un grand respect.
57,facteur,Un élément qui contribue à un résultat.,L'alimentation et l'exercice physique sont des facteurs clés pour déterminer la santé à long terme d'un individu.
58,fonctionnalité,Une caractéristique ou un attribut distinctif de quelque chose.,Un élément clé d'une planification urbaine réussie est la mise à disposition d'espaces verts accessibles.
59,se concentrer,Concentrer son attention ou ses efforts sur quelque chose.,La politique gouvernementale devrait se concentrer sur la fourniture de logements abordables aux familles à faibles revenus.
60,fonction,Le but ou le rôle que quelque chose est conçu pour remplir.,La fonction principale du système immunitaire est de protéger l'organisme contre les maladies.
61,générer,Produire ou créer quelque chose.,Les panneaux solaires peuvent produire suffisamment d'électricité pour alimenter une maison entière.
62,mondial,Relatif au monde entier ou le couvrant.,La coopération mondiale est essentielle pour relever efficacement les défis du changement climatique.
63,gouverner,Contrôler ou diriger un pays ou une organisation.,Les nations démocratiques doivent être gouvernées de manière à refléter la volonté du peuple.
64,croissance,Le processus d'augmentation de la taille ou de la valeur.,Une croissance économique soutenue est nécessaire pour réduire le chômage et améliorer le niveau de vie.
65,nuire,Dommages physiques ou psychologiques causés à quelque chose.,L’utilisation excessive des réseaux sociaux peut causer des dommages psychologiques aux jeunes vulnérables.
66,santé,L'état d'être exempt de maladie ou de blessure.,Les gouvernements doivent investir dans les infrastructures de santé publique pour prévenir la propagation des maladies.
67,impact,Un effet ou une influence importante sur quelque chose.,L'urbanisation a un impact significatif sur les écosystèmes locaux et les ressources en eau.
68,mettre en œuvre,Mettre en œuvre un plan ou une décision.,Le gouvernement prévoit de mettre en œuvre de nouvelles réglementations pour réduire les émissions de carbone industrielles.
69,améliorer,Améliorer ou devenir de meilleure qualité.,L'investissement dans l'éducation est le moyen le plus efficace d'améliorer les résultats économiques à long terme.
70,augmenter,Devenir ou augmenter la quantité de quelque chose.,Le nombre de véhicules électriques vendus dans le monde a connu une augmentation spectaculaire.
71,indiquer,Montrer ou désigner quelque chose comme probable.,Des études récentes indiquent qu'une activité physique régulière réduit le risque de maladies chroniques.
72,individuel,"Une personne seule, distincte d'un groupe.",La protection des droits individuels est une pierre angulaire de toute société démocratique.
73,influence,Le pouvoir d'avoir un effet sur les personnes ou les choses.,Les réseaux sociaux exercent une profonde influence sur les opinions politiques des jeunes.
74,infrastructure,Systèmes physiques de base soutenant une communauté.,Investir dans les infrastructures de transport est essentiel pour stimuler le développement économique régional.
75,initiative,Un nouveau plan ou une nouvelle action visant à résoudre un problème.,"Le gouvernement a lancé une nouvelle initiative pour encourager les jeunes à s'orienter vers des carrières dans les domaines des sciences, de la technologie, de l'ingénierie et des mathématiques (STEM)."
76,institution,Une organisation établie ayant une vocation sociale.,Les institutions démocratiques doivent rester indépendantes pour garantir une société juste et équitable.
77,impliquer,Inclure ou exiger quelque chose comme partie intégrante.,Une planification urbaine efficace doit impliquer activement les résidents dans le processus décisionnel.
78,problème,Un sujet ou un problème important à discuter.,Le changement climatique est l'un des problèmes les plus urgents auxquels la communauté internationale est confrontée aujourd'hui.
79,justifier,Démontrer ou prouver que quelque chose est juste ou raisonnable.,Les gouvernements doivent pouvoir justifier l'augmentation des dépenses de défense auprès de leurs citoyens.
80,manque,Une absence ou une pénurie de quelque chose de nécessaire.,Le manque d'accès à l'eau potable demeure un défi majeur dans les pays en développement.
81,limite,Un point au-delà duquel quelque chose ne peut aller.,Les nations doivent s'entendre sur des limites juridiquement contraignantes en matière d'émissions de dioxyde de carbone.
82,maintenir,Maintenir quelque chose dans son état ou sa condition actuelle.,Il est de plus en plus difficile de préserver la biodiversité dans les zones fortement urbanisées.
83,majeur,D'une grande importance ou d'une gravité considérable.,La pollution atmosphérique constitue un problème majeur de santé publique dans de nombreuses grandes villes du monde.
84,gérer,Être responsable de quelque chose ou le contrôler.,Le développement durable exige des gouvernements qu'ils gèrent soigneusement les ressources naturelles.
85,mesure,Une action entreprise pour atteindre un objectif ; quantifier.,Les gouvernements doivent prendre des mesures décisives pour s'attaquer au problème croissant du chômage des jeunes.
86,méthode,Une manière particulière de faire quelque chose de façon systématique.,Les scientifiques doivent adopter des méthodes de recherche rigoureuses pour garantir la validité de leurs résultats.
87,émigrer,Se déplacer d'une région ou d'un pays à un autre.,De nombreux travailleurs ruraux migrent vers les villes à la recherche de meilleures opportunités d'emploi.
88,moderne,Relatif à l'époque actuelle ; contemporain.,Les technologies modernes ont fondamentalement changé la façon dont les gens communiquent et accèdent à l'information.
89,moniteur,Observer et vérifier quelque chose au fil du temps.,Les autorités sanitaires doivent surveiller en permanence la qualité de l'air dans les zones urbaines densément peuplées.
90,national,Relatif à ou typique d'une nation entière.,Le gouvernement a mis en place un programme national afin d'uniformiser l'éducation dans tout le pays.
91,naturel,Existant dans la nature ou produit par elle.,La surexploitation des ressources naturelles constitue une grave menace pour la durabilité écologique.
92,nécessaire,Obligatoire ou absolument nécessaire.,Il est nécessaire que les gouvernements investissent dans les infrastructures pour soutenir la croissance économique.
93,négatif,Nuisible ou défavorable par nature ou par effet.,L'exposition prolongée au harcèlement en ligne peut avoir de graves conséquences négatives sur la santé mentale.
94,obtenir,Obtenir ou acquérir quelque chose par l'effort.,Les étudiants doivent obtenir une note minimale pour être admissibles aux programmes de bourses universitaires.
95,se produire,Se produire ou avoir lieu.,On prévoit que les catastrophes naturelles seront plus fréquentes en raison du changement climatique.
96,opportunité,Une situation favorable qui permet le progrès.,L'accès à une éducation de qualité offre aux jeunes de meilleures perspectives économiques.
97,résultat,Le résultat ou la conséquence d'une action.,Les programmes d'intervention précoce tendent à produire de meilleurs résultats scolaires pour les enfants.
98,participer,Participer à une activité ou à un événement.,Il convient d'encourager les citoyens à participer activement à la prise de décision au niveau local.
99,politique,Un plan ou une ligne de conduite adoptés par une autorité.,Une politique énergétique efficace est essentielle pour réduire l'empreinte carbone d'un pays.
100,polluer,Contaminer l'environnement avec des substances nocives.,Les activités industrielles continuent de polluer les rivières et de nuire aux écosystèmes aquatiques à l'échelle mondiale.
101,population,Tous les habitants d'un lieu donné.,Le vieillissement de la population pose des défis importants aux systèmes de retraite et de santé.
102,positif,Qui a un effet bénéfique ou positif.,Une attitude positive envers l'apprentissage tout au long de la vie peut améliorer considérablement les perspectives de carrière.
103,potentiel,Avoir la capacité de développer ou de réaliser quelque chose.,L'intelligence artificielle a le potentiel de transformer le diagnostic et le traitement des soins de santé.
104,prévenir,Pour empêcher quelque chose de se produire.,Les programmes de vaccination constituent l'un des moyens les plus efficaces de prévenir la propagation des maladies.
105,primaire,Le plus important ou premier par ordre de priorité.,L'objectif premier de tout système de santé devrait être de protéger et de promouvoir le bien-être.
106,processus,Une série d'étapes pour atteindre un résultat.,Le processus démocratique repose sur l'accès des citoyens à une information impartiale et exacte.
107,produire,Fabriquer ou créer quelque chose.,Les usines qui produisent des niveaux élevés d'émissions doivent être soumises à des réglementations plus strictes.
108,promouvoir,Soutenir ou encourager le développement de quelque chose.,Les campagnes de promotion de saines habitudes alimentaires peuvent contribuer à réduire les taux d'obésité infantile.
109,proposer,Proposer un plan ou une suggestion.,Plusieurs économistes ont proposé une taxe carbone comme solution pour réduire les émissions.
110,protéger,Pour se protéger de tout danger ou dommage.,Les gouvernements ont le devoir de protéger les citoyens des conséquences de la pollution environnementale.
111,fournir,Mettre quelque chose à la disposition de quelqu'un.,L’État doit fournir des services de santé de base à tous les citoyens sans discrimination.
112,but,La raison d'être de quelque chose ou de ce qui est fait.,L'objectif principal de l'enseignement supérieur est de doter les étudiants de compétences en pensée critique.
113,augmenter,Accroître ou attirer l'attention sur un sujet.,Les organisations internationales continuent de sensibiliser l'opinion publique aux effets du changement climatique.
114,réduire,Réduire la quantité de quelque chose.,Le gouvernement vise à réduire les émissions de carbone de 50 % au cours des vingt prochaines années.
115,refléter,Montrer ou réfléchir profondément à quelque chose.,Les politiques gouvernementales doivent refléter fidèlement les besoins et les valeurs de l'ensemble de la population.
116,région,Une vaste zone aux caractéristiques distinctes.,Le développement économique varie considérablement entre les régions côtières et les régions intérieures du pays.
117,réglementer,Contrôler quelque chose au moyen de règles.,Les gouvernements doivent réglementer l'utilisation des plateformes de médias sociaux afin de protéger les jeunes utilisateurs.
118,se rapporter,Avoir un lien ou une connexion avec quelque chose.,Les fortes inégalités sont étroitement liées à l'augmentation des taux de criminalité et des troubles sociaux.
119,libérer,Permettre à quelque chose d'être libéré ou déchargé.,Les procédés industriels continuent de rejeter de grandes quantités de polluants dans l'atmosphère.
120,compter sur,Dépendre de quelqu'un ou de quelque chose.,De nombreux pays en développement dépendent encore fortement des combustibles fossiles pour leurs besoins énergétiques.
121,représenter,Défendre ou agir au nom de quelque chose.,Les élus ont le devoir de représenter équitablement les intérêts de leurs électeurs.
122,exiger,Avoir besoin de quelque chose d'essentiel ou d'obligatoire.,La lutte contre le changement climatique exige une coopération internationale urgente et un engagement politique fort.
123,recherche,Enquête systématique visant à établir de nouveaux faits.,Des investissements importants dans la recherche médicale sont nécessaires pour lutter contre les maladies infectieuses émergentes.
124,ressource,Une ressource pouvant être utilisée dans un but précis.,Les nations doivent gérer leurs ressources naturelles de manière responsable afin d'assurer une durabilité à long terme.
125,répondre,Réagir ou répondre à quelque chose.,Les gouvernements doivent réagir rapidement aux catastrophes naturelles afin de minimiser le nombre de victimes et les souffrances.
126,résultat,Ce qui découle d'une action.,Une mauvaise alimentation et un mode de vie sédentaire entraînent souvent de graves problèmes de santé à long terme.
127,retenir,Continuer à conserver ou à détenir quelque chose.,Les entreprises doivent élaborer de meilleures stratégies pour fidéliser leurs employés talentueux sur des marchés concurrentiels.
128,révéler,Révéler quelque chose qui était auparavant caché.,Des recherches récentes révèlent une forte corrélation entre les inégalités de revenus et les mauvais résultats en matière de santé.
129,rôle,La fonction ou la position qu'occupe une personne ou une chose.,L'éducation joue un rôle crucial dans la réduction des inégalités sociales et la promotion de la mobilité sociale.
130,rural,Relatif à la campagne plutôt qu'aux villes.,Les communautés rurales n'ont souvent pas accès aux mêmes ressources éducatives que les populations urbaines.
131,secteur,Une partie distincte de l'économie ou de la société.,Le secteur public joue un rôle essentiel dans la prestation de services indispensables aux citoyens.
132,significatif,Suffisamment important ou grand pour avoir un effet.,On a constaté une réduction statistiquement significative des taux de criminalité au cours des dernières décennies.
133,société,Une communauté de personnes vivant ensemble.,Une société juste et équitable doit garantir l'égalité des chances à tous ses citoyens.
134,solution,Une façon de résoudre un problème.,La coopération internationale est nécessaire pour trouver des solutions durables au changement climatique mondial.
135,source,L'origine ou la fourniture de quelque chose.,Les chercheurs doivent citer des sources fiables lorsqu'ils présentent des preuves dans des travaux universitaires.
136,standard,Un niveau de qualité ou de réussite attendu.,L'élévation du niveau d'éducation est considérée comme essentielle pour améliorer la compétitivité économique nationale.
137,stratégie,Un plan conçu pour atteindre un objectif à long terme.,Le gouvernement a dévoilé une nouvelle stratégie nationale pour lutter contre la hausse des taux d'obésité.
138,structure,L'agencement organisé des parties d'un objet.,Des structures sociales rigides peuvent entraver la mobilité sociale ascendante et perpétuer les inégalités.
139,suggérer,Proposer une idée ou une possibilité.,Des études suggèrent que l'éducation préscolaire a des effets bénéfiques durables sur le développement cognitif.
140,soutien,Apporter son aide ou plaider en faveur de quelque chose.,Le soutien financier des gouvernements aux petites entreprises est crucial en période de ralentissement économique.
141,soutenir,Maintenir ou faire perdurer quelque chose dans le temps.,Il est essentiel d'adopter des politiques qui soutiennent la croissance économique sans nuire à l'environnement.
142,système,Un ensemble organisé d'éléments interdépendants.,Un système de santé bien financé est essentiel pour maintenir une population saine et productive.
143,cible,Un objectif ou un groupe visant spécifiquement.,Les pays doivent se fixer des objectifs ambitieux de réduction des émissions de gaz à effet de serre d'ici à 2050.
144,technologie,Connaissances scientifiques appliquées à des fins pratiques.,Les progrès technologiques ont rendu possible l'accès à l'information partout dans le monde.
145,tendre,Avoir une inclination générale pour quelque chose.,Les pays les plus riches ont tendance à produire davantage d'émissions de carbone par habitant que les pays en développement.
146,théorie,Un système d'idées utilisé pour expliquer les phénomènes.,La théorie de l'évolution de Darwin a fondamentalement changé notre compréhension de la vie sur Terre.
