id,front,back,example
300,ilerleyici,Reformu ve toplumsal ilerlemeyi desteklemek.,"Artan oranlı vergi sistemi, yüksek gelirli kişilerin daha büyük oranda vergi ödemesini sağlar."
301,oran,Bir bütünün parçası; karşılaştırmalı oran.,Ulusal servetin orantısız derecede büyük bir kısmı nüfusun küçük bir kesiminin elinde bulunuyor.
302,psikolojik,Zihin ve zihinsel süreçlerle ilgili.,İşsizliğin depresyon ve kimlik kaybı da dahil olmak üzere ciddi psikolojik sonuçları olabilir.
303,durgunluk,Önemli bir ekonomik gerileme dönemi.,"Ekonomik durgunluk döneminde, artan işsizlik ve azalan tüketici harcamaları olumsuz bir döngü yaratır."
304,rehabilitasyon,Sağlığın veya normal yaşamın yeniden kazanılması süreci.,"Rehabilitasyon programlarına yatırım yapmak, yeniden suç işleme oranlarını yalnızca hapis cezasına kıyasla daha etkili bir şekilde düşürmektedir."
305,yenilenebilir,Doğal olarak yenilenebilen bir kaynak.,"Yenilenebilir enerji kaynaklarına yatırım, küresel ölçekte fosil yakıtlara olan bağımlılığı azaltmak için hayati önem taşımaktadır."
306,kısıtlama,Faaliyetleri sınırlayan bir kural veya koşul.,"Pandemi sırasında uygulanan seyahat kısıtlamaları, küresel turizmde önemli aksamalara neden oldu."
307,hasılat,Hükümet veya işletme tarafından elde edilen gelir.,"Hükümetler, sağlık ve eğitim gibi temel kamu hizmetlerini finanse etmek için vergi gelirlerine güvenir."
308,devrim,Toplumda dramatik ve temel bir değişim.,"Sanayi devrimi, küresel ekonomiyi ve insan emeğinin biçimlerini temelden değiştirdi."
309,sanitasyon,Hijyen ve atık yönetimi sistemleri.,"Nüfus yoğunluğunun yüksek olduğu kentsel alanlarda yetersiz hijyen koşulları, bulaşıcı hastalıkların yayılmasına katkıda bulunur."
310,kıtlık,İhtiyaç duyulan kaynağın yetersiz tedariği.,"Su kıtlığı, önümüzdeki on yıllarda insanlığın hayatta kalması için en ciddi tehditlerden birini oluşturmaktadır."
311,şüpheci,İddiaları sorgulamaya veya şüphe duymaya meyilli.,"Birçok ekonomist, mevcut hükümet harcamalarının uzun vadeli sürdürülebilirliği konusunda şüpheci kalmaya devam ediyor."
312,sosyal hareketlilik,Sosyal sınıflar arasında geçiş yapabilme yeteneği.,"Eğitim, sosyal hareketliliği artırmak için en güçlü araç olarak kabul edilmektedir."
313,klişe,"Bir grubun sabit, aşırı basitleştirilmiş bir görüntüsü.",Medya temsilleri genellikle azınlık toplulukları hakkında zararlı klişeleri pekiştirir.
314,uyarıcı,Bir tepkiye veya eyleme yol açan şey.,"Hükümet, durgunluğun ardından ekonomiyi canlandırmak için büyük bir teşvik paketi başlattı."
315,banliyö,Şehrin eteklerinde yer alan bir yerleşim bölgesi.,"Banliyölerin büyümesi, otomobil bağımlılığını artırdı ve kentleşmenin yayılmasına katkıda bulundu."
316,gözetim,Özellikle yetkililer tarafından yakından gözlem.,"Hükümetlerin kitlesel gözetimi, bireysel mahremiyet ve sivil özgürlükler konusunda ciddi endişeler doğurmaktadır."
317,vergilendirme,Vatandaşlardan vergi alma sistemi.,"Adil ve kademeli vergilendirme, kamu hizmetlerinin finansmanı ve eşitsizliğin azaltılması için şarttır."
318,geçiş,Bir halden diğerine geçiş.,Küresel sıcaklık artışını sınırlamak için yenilenebilir enerjiye hızlı bir geçiş şarttır.
319,şeffaflık,Süreçlerde veya yönetimde açıklık ve şeffaflık.,"Devlet harcamalarında daha fazla şeffaflık, yolsuzluğu azaltmaya ve kamu güvenini artırmaya yardımcı olabilir."
320,işsizlik,Ücretli bir işi olmama durumu.,"Otomasyonun yol açtığı yapısal işsizlik, dünya genelindeki hükümetler için büyük bir zorluk teşkil etmektedir."
321,kentleşme,Şehirlerde yaşayan insanların oranı giderek artıyor.,"Asya'daki hızlı kentleşme mega şehirler yaratmış olsa da, ciddi altyapı sorunlarına da yol açmıştır."
322,aşı,Hastalıklara karşı bağışıklık sağlayan tedavi.,"Kitlesel aşılama programları, çiçek hastalığı gibi hastalıkları ortadan kaldırmış ve dünya çapında çocuk felcini kontrol altına almıştır."
323,gönüllü,"Dış baskı olmaksızın, gönüllü olarak yapılmıştır.","Gönüllü kuruluşlar, toplumun savunmasız kesimlerini desteklemede çok önemli bir rol oynamaktadır."
324,güvenlik açığı,Zarara veya zorluğa maruz kalmak.,"Küçük ada ülkeleri, yükselen deniz seviyelerinin sonuçlarına karşı son derece savunmasız durumdadır."
325,yaygın,Geniş bir alanda bulunan veya dağılmış olan.,"İnternete yaygın erişim, küresel ölçekte iletişimi ve bilgiye erişimi dönüştürdü."
326,işgücü,İşe alınmaya müsait tüm kişiler.,"Yaşlanan işgücü, gelişmiş ülkelerdeki emeklilik sistemleri için önemli zorluklar yaratmaktadır."
327,teslim olmak,Bir sonuç veya ürün üretmek veya sağlamak.,"Gelişen tarım teknikleri, kuraklığa eğilimli bölgelerde çiftçilerin daha büyük ürünler elde etmelerine yardımcı oldu."
328,kötüleştirmek,Bir sorunu veya durumu daha da kötüleştirmek.,"İklim değişikliğinin, hassas bölgelerdeki mevcut gıda güvenliği sorunlarını daha da kötüleştirmesi bekleniyor."
329,paylaştırma,Kaynakların belirli bir amaç doğrultusunda dağıtılması.,"Kamu kaynaklarının etkin tahsisi, ulusal sağlık hizmetleri sonuçlarını iyileştirmek için şarttır."
330,entegrasyon,Parçaları bir araya getirerek bir bütün oluşturma süreci.,"Göçmenlerin başarılı sosyal entegrasyonu, dil eğitimine ve toplumsal desteğe yatırım yapılmasını gerektirir."
331,hesap verebilirlik,Kişinin kendi eylemlerinden ve kararlarından sorumlu olması.,"Kamu kurumlarında daha fazla hesap verebilirlik, vatandaşların hükümete olan güvenini korumak için şarttır."
332,uyarlanabilir,Yeni koşullara uyum sağlayabilme yeteneğine sahip.,"Uyarlanabilir yönetim stratejileri, kuruluşların hızla değişen ortamlara etkili bir şekilde yanıt vermesini sağlar."
333,ağırlaştırmak,Bir sorunu veya durumu daha da ciddileştirmek.,"Yetersiz hükümet müdahalesi, ekonomik durgunluğun sosyal sonuçlarını daha da kötüleştirebilir."
334,insan kaynaklı,İnsan faaliyetinden kaynaklanan veya insan faaliyeti sonucu oluşan.,"Bilim insanları, insan kaynaklı sera gazı emisyonlarının küresel ısınmanın başlıca nedeni olduğu konusunda hemfikir."
335,asimilasyon,Bir grubun baskın kültüre karışması.,"Yerli halkların zorla kültürel asimilasyonuna maruz bırakılması, insan hakları örgütleri tarafından geniş çapta kınanmıştır."
336,kemer sıkma politikası,Borcu azaltmak için hükümet harcamalarında ciddi kesintiler.,"Finansal krizin ardından uygulanan kemer sıkma önlemleri, kamu hizmetlerinde ciddi kesintilere yol açtı."
337,otomasyon,Görevleri otomatik olarak gerçekleştirmek için teknolojinin kullanılması.,"Üretim süreçlerinin otomasyonu, vasıfsız işgücüne olan ihtiyacı önemli ölçüde azalttı."
338,biyolojik olarak parçalanabilir,Doğal organizmalar tarafından parçalanabilir.,"Plastik ambalajların biyolojik olarak parçalanabilir ambalajlarla değiştirilmesi, çevre kirliliğini azaltmaya yönelik önemli bir adımdır."
339,bürokrasi,Karmaşık bir kurallar ve resmi süreçler sistemi.,"Kamu kurumlarındaki aşırı bürokrasi, temel hizmetlerin verimli bir şekilde sunulmasını engelleyebilir."
340,katalizör,Bir süreci tetikleyen veya hızlandıran şey.,"Pandemi, dünya çapında uzaktan çalışma uygulamalarının yaygın olarak benimsenmesi için bir katalizör görevi gördü."
341,sivil katılım,Toplumsal ve siyasi hayata aktif katılım.,"Gençler arasında düşük düzeyde sivil katılım, demokratik yönetişim için önemli bir tehdit oluşturmaktadır."
342,birlikte yaşama,Farklılıklara rağmen barış içinde bir arada yaşamak.,Farklı etnik topluluklar arasında barış içinde bir arada yaşamayı sağlamak karşılıklı saygı ve anlayış gerektirir.
343,bilişsel,Düşünme ve öğrenme gibi zihinsel süreçlerle ilgili.,"Erken çocukluk eğitimi, uzun vadeli bilişsel gelişim ve akademik performans üzerinde derin bir etkiye sahiptir."
344,uyum,Bütünleşik bir yapı oluşturma niteliği.,"Yüksek düzeydeki eşitsizlik, toplumsal uyumu zayıflatır ve toplumsal huzursuzluk riskini artırır."
345,metalaştırmak,Bir şeyi ticari ürün gibi ele almak.,"Eleştirmenler, hükümetlerin eğitimi bir piyasa ürünü gibi ele alarak ticarileştirmemesi gerektiğini savunuyor."
346,zorunlu,Kanun veya kurallar gereği zorunlu; mecburi.,"Zorunlu eğitim yasaları, dünya genelinde okuryazarlık oranlarının artmasında etkili olmuştur."
347,tasavvur etmek,Bir fikri veya planı oluşturmak veya geliştirmek.,Enerji tüketiminde köklü bir değişim olmadan sürdürülebilir bir gelecek tasavvur etmek zordur.
348,konsolide etmek,Birleştirmek veya güçlendirmek suretiyle bütün bir bütün haline getirmek.,"Birleşme, iki şirketin kaynaklarını birleştirmesine ve operasyonel verimliliği artırmasına olanak sağladı."
349,kirlenme,Bir maddenin içinde zararlı kirleticilerin bulunması.,"Sanayi atıkları, çevredeki kırsal bölgelerde yeraltı sularının yaygın şekilde kirlenmesine neden olmuştur."
350,tartışma,Tartışma konusu veya hararetli bir münakaşa.,"Göç politikası, birçok ülkede siyasi tartışmalarda hâlâ önemli bir çekişme noktası olmaya devam ediyor."
351,merkezsizleştirmek,Gücün merkezi yönetimden yerel yönetime aktarılması.,"Yönetimi merkezsizleştirme çabaları, yerel toplulukları güçlendirebilir ve kamu hizmetlerinin sunumunu iyileştirebilir."
352,kasıtlı,Kasıtlı olarak yapılmış; dikkatlice düşünülmüş.,"Politika tartışmalarından azınlık seslerinin dışlanması, kasıtlı bir siyasi strateji gibi görünüyor."
353,bağımlılık,Bir şeye aşırı derecede bağımlı olma durumu.,"Birçok gelişmekte olan ülke, tek bir ihracat ürününe olan ekonomik bağımlılıklarını azaltmakta zorlanıyor."
354,yoksunluk,Temel ihtiyaçlardan yoksunluktan kaynaklanan zararlı bir durum.,Aşırı yoksulluk içinde büyüyen çocukların akademik başarıya ulaşma olasılığı önemli ölçüde daha düşüktür.
355,çölleşme,Arazinin çöl benzeri koşullara dönüşmesi.,"Çölleşme, dünya genelinde yarı kurak bölgelerde yaşayan milyonlarca insanın geçim kaynaklarını tehdit ediyor."
356,bozulma,Giderek kötüleşen bir süreç.,"Kent altyapısının bozulması, birçok şehirde yaşayanlar için ciddi güvenlik riskleri oluşturmaktadır."
357,orantısız,Başka bir şeye göre çok büyük veya çok küçük.,"Dışlanmış topluluklar, çevre kirliliğinin sonuçlarından orantısız bir şekilde daha fazla etkilenmektedir."
358,seçim,Seçimlerle veya oy verme süreciyle ilgili.,"Seçim reformu, tüm vatandaşların hükümette adil bir şekilde temsil edilmesini sağlamak için şarttır."
359,göç,Kişinin ülkesini terk edip başka bir yere yerleşmesi.,"Yüksek göç oranları, gelişmekte olan ülkeleri en yetenekli ve eğitimli vatandaşlarından mahrum bırakabilir."
360,ampirik,Teoriden ziyade gözlem ve kanıtlara dayanmaktadır.,Sağlıklı politika kararları ideolojik varsayımlardan ziyade ampirik kanıtlara dayanmalıdır.
361,onay,Kamuoyuna açık destek veya onay beyanı.,"Ünlü bir ismin desteği, önemli sosyal ve siyasi konularda kamuoyunu önemli ölçüde etkileyebilir."
362,girişimcilik,İşletme kurma ve işletme faaliyeti.,"Hükümetler, girişimciliği ve yeniliği destekleyen koşullar yaratarak ekonomik büyümeyi teşvik edebilirler."
363,etik ikilem,Ahlaki ilkeler arasında seçim yapmayı gerektiren bir çatışma.,"Genetik mühendisliğindeki gelişmeler, toplumu dikkatli bir değerlendirme gerektiren derin etik ikilemlerle karşı karşıya bırakmaktadır."
364,şiddetlenme,Bir sorunu daha da ciddi hale getirme süreci.,"Hızlı nüfus artışı, zaten zor durumda olan bölgelerdeki kaynak kıtlığını daha da kötüleştiriyor."
365,dışlama,Erişim veya üyeliği engelleme eylemi.,"Savunmasız grupların sosyal dışlanması, gerçek toplumsal eşitliğe ulaşmanın önündeki en büyük engellerden biridir."
366,sömürü,Birinin veya bir şeyin haksız kazanç amacıyla kullanılması.,Çokuluslu şirketlerin gelişmekte olan ülkelerdeki ucuz iş gücünü sömürmesi ciddi etik sorunlar doğurmaktadır.
367,üstel,Hızla artan veya azalan bir oranda.,"Sosyal medya kullanımındaki üstel artış, insanların küresel olarak bilgi tüketme biçimini dönüştürdü."
368,dalgalanma,Zaman içinde düzensiz değişim veya varyasyon.,"Küresel petrol fiyatlarındaki sert dalgalanmalar, petrole bağımlı ülkelerin ekonomilerini istikrarsızlaştırabilir."
369,formüle etmek,Sistematik olarak oluşturmak veya tasarlamak.,"Hükümetler, ekonomik büyüme ile çevre korumasını dengeleyecek politikaları dikkatlice formüle etmelidir."
370,parçalanma,"Bir şeyin küçük, birbirinden ayrı parçalara ayrılması.","Siyasi partilerin parçalanması, istikrarlı hükümetler kurmayı giderek zorlaştırdı."
371,gayri safi yurtiçi Hasıla,Bir ülkenin yıllık üretiminin toplam parasal değeri.,"Birçok ekonomist, gayri safi yurtiçi hasılanın ulusal refahın yetersiz bir ölçüsü olduğunu savunmaktadır."
372,hegemonya,Bir grubun diğerleri üzerinde hakimiyet kurması.,"Batılı ulusların kültürel hegemonyası, küresel medya ve tüketici tercihlerini önemli ölçüde etkilemiştir."
373,homojenizasyon,Her şeyi baştan sona aynı veya benzer hale getirmek.,"Eleştirmenler, küreselleşmenin çeşitliliğin azalması pahasına toplumların kültürel olarak homojenleşmesine yol açtığını savunuyor."
374,insani yardım,İnsanların refahını ve çektiği acıları azaltmayı amaçlamaktadır.,"Uluslararası insani yardım, silahlı çatışmalardan ve afetlerden etkilenen nüfusları desteklemek için hayati önem taşımaktadır."
375,ideoloji,Siyasi eylemlerin temelini oluşturan inanç sistemi.,Ekonomi politikası çoğu zaman ampirik kanıt ve araştırmalardan ziyade siyasi ideoloji tarafından şekillendirilir.
376,dayatmak,Bir şeyi otorite yoluyla başkalarına zorla kabul ettirmek.,"Uluslararası kuruluşlar, insan hakları anlaşmalarını ihlal eden hükümetlere yaptırım uygulayabilir."
377,hapis,Hapsedilme hali.,"Bazı ülkelerdeki yüksek hapis oranları, adalet ve rehabilitasyon konusunda ciddi soruları gündeme getiriyor."
378,başlangıç,Bir şeyin başlangıcı veya kuruluşu.,"Kuruluşundan bu yana, örgüt küresel yoksulluğu hafifletmede önemli ilerleme kaydetmiştir."
379,dahil,Hiçbir grup veya bireyi dışlamadan.,"Kapsayıcı bir eğitim sistemi, engelli çocukların eşit öğrenme fırsatlarına sahip olmasını sağlar."
380,yerli,Belirli bir bölgede doğal olarak ortaya çıkan.,Yerli halkların atalarından kalma topraklara ilişkin hakları uluslararası hukuk kapsamında korunmalıdır.
381,sanayileşme,Büyük ölçekli endüstriyel üretime geçiş.,Gelişmekte olan ülkelerin sanayileşmesi ekonomik büyümeyi beraberinde getirmiş ancak aynı zamanda önemli çevresel zararlara da yol açmıştır.
382,verimsizlik,Zamanı veya kaynakları en iyi şekilde kullanamama.,"Yaygın bürokratik verimsizlik, hükümetlerin hizmetleri etkili ve adil bir şekilde sunmasını engellemektedir."
383,kurumsal,Kurulu kuruluşlar veya sistemlerle ilgili.,"Hukuk sistemlerine yerleşmiş kurumsal ırkçılık, dünya çapında azınlık topluluklarını dezavantajlı duruma düşürmeye devam ediyor."
384,karşılıklı bağımlılık,İki veya daha fazla grup arasında karşılıklı bağımlılık.,"Küresel pandemi, modern dünyada ulusal ekonomilerin derin karşılıklı bağımlılığını ortaya koymuştur."
385,gözdağı,Birini korkutmak veya tehdit etmek suretiyle baskı uygulamak.,Seçmenlerin sindirilmesi demokratik süreci baltalar ve özgür ve adil seçimlerin yapılmasını engeller.
386,yargı yetkisi,Kanunları uygulama yetkisine sahip resmi makam.,"Siber suçlar, sıklıkla birden fazla yasal yargı alanında meydana geldiği için karmaşık zorluklar sunmaktadır."
387,yan yana koymak,Zıtlığı vurgulamak için iki şeyi yan yana koymak.,"Rapor, varlıklı elitlerin yaşam tarzlarını aşırı yoksulluk içinde yaşayanların yaşam tarzlarıyla karşılaştırıyor."
388,meşru,Kanunlara veya kabul görmüş standartlara uygun olmak.,"Meşru bir hükümet, vatandaşlarına karşı hesap verebilir olmalı ve temel insan haklarına saygı göstermelidir."
389,yetersiz beslenme,Yetersiz veya dengesiz beslenmeden kaynaklanan sağlık sorunları.,"Çatışma bölgelerinde yaygın görülen yetersiz beslenme, ciddi ve acil bir küresel insani krizi temsil etmektedir."
390,tezahür,Bir şeyin gözle görülür işareti veya ifadesi.,"Evsizlik, birçok gelişmiş şehirde konut politikasının başarısızlığının çarpıcı bir göstergesidir."
391,marjinalleşme,Bir grubu ikincil olarak ele alma süreci.,"Etnik azınlıkların işgücü piyasasında dışlanması, yoksulluk ve eşitsizlik döngülerini sürdürmektedir."
392,meritokrasi,İlerlemenin yeteneğe dayalı olduğu bir sistem.,"Eleştirmenler, sistemik eşitsizlik ele alınmadığı sürece gerçek bir liyakat sisteminin imkansız olduğunu savunuyor."
393,hafifletme,Zararlı bir durumun etkisini azaltmaya yönelik eylem.,Küresel iklim değişikliğinin en kötü etkilerini sınırlamak için acilen etkili azaltma stratejilerine ihtiyaç duyulmaktadır.
394,tekel,Bir pazarın tek bir kuruluş tarafından münhasır olarak kontrol edilmesi.,Kontrolsüz tekeller rekabeti azaltır ve nihayetinde tüketiciler için daha yüksek fiyatlara yol açar.
395,çok taraflı,İkiden fazla tarafı veya ülkeyi kapsayan.,"İklim değişikliğiyle etkili bir şekilde mücadele etmek, başlıca emisyon salan tüm ülkeler arasında çok taraflı işbirliğini gerektirir."
396,ihmal etmek,Bir şeye özen göstermemek veya onunla ilgilenmemek.,"Yıllarca süren siyasi ihmal, birçok kırsal topluluğu yeterli sağlık hizmeti veya eğitimden mahrum bıraktı."
397,neoliberal,"Serbest piyasa ekonomisini, özelleştirmeyi ve düzenlemelerin kaldırılmasını destekliyor.","Eleştirmenler, neoliberal ekonomi politikalarının küresel ölçekte zengin ve fakir arasındaki uçurumu genişlettiğini savunuyor."
398,normlar,Bir toplumda kabul görmüş davranış standartları.,"Cinsiyet rolleriyle ilgili değişen toplumsal normlar, modern iş yerini kademeli olarak dönüştürdü."
399,modası geçmiş,Artık kullanılmıyor; eskimiş ve güncelliğini yitirmiş.,"Hızlı teknolojik gelişmeler, geleneksel üretim becerilerinin çoğunu neredeyse geçersiz hale getirdi."
400,baskı,"Başkaları üzerinde uzun süreli, haksız otorite veya kontrol.","Azınlık gruplarına yönelik tarihsel baskı, günümüzde de devam eden derin eşitsizlikler yaratmıştır."
401,salgın,Ani bir hastalık veya şiddet olayının ortaya çıkması.,"Yeni bir viral hastalığın ortaya çıkması, uluslararası düzeyde acil halk sağlığı önlemlerinin alınmasını zorunlu kıldı."
402,kişi başına,Belirli bir popülasyondaki her birey için.,"Kişi başına düşen GSYİH, farklı ülkelerdeki ortalama yaşam standardını karşılaştırmak için yaygın olarak kullanılır."
403,kutuplaşma,Birbirinden tamamen farklı iki gruba ayrılma.,"Siyasi kutuplaşma, önemli ulusal meselelerde iki partinin işbirliğini giderek zorlaştırdı."
404,özelleştirme,Devlete ait varlıkların özel mülkiyete devredilmesi.,"Su ve enerji gibi kamu hizmetlerinin özelleştirilmesi, erişilebilirliği azalttığı gerekçesiyle yaygın olarak eleştirilmiştir."
405,çoğalma,Bir şeyin sayısında hızlı artış.,"Sosyal medyada yanlış bilgilerin yayılması, demokratik süreçler için ciddi bir tehdit oluşturmaktadır."
406,yakınlık,"Mekân, zaman veya ilişki açısından yakınlık.","Ekonomik merkezlere coğrafi yakınlık, bir bölgenin gelişmesini ve büyümesini önemli ölçüde etkiler."
407,onaylamak,Bir anlaşmayı veya yasayı resmen onaylamak.,Küresel iklim taahhütlerinin anlamlı bir etki yaratabilmesi için daha fazla ülkenin Paris Anlaşması'nı onaylaması gerekiyor.
408,tekrarlayan suç,Önceki mahkumiyetin ardından tekrar suç işleme eğilimi.,"Etkin rehabilitasyon programlarının, eski suçlular arasında yeniden suç işleme oranlarını azalttığı kanıtlanmıştır."
409,yeniden dağıtım,Daha fazla eşitlik sağlamak için kaynakların yeniden dağıtılması.,"Artan oranlı vergilendirme, servetin en zenginlerden en dezavantajlı kesimlere yeniden dağıtılmasını mümkün kılar."
410,güçlendirmek,Mevcut bir fikri veya yapıyı güçlendirmek veya desteklemek.,"Medyanın suç olaylarını tasvir ediş biçimi, istemeden de olsa belirli sosyal gruplar hakkındaki olumsuz stereotipleri pekiştirebilir."
411,dayanıklılık,Zorlukların üstesinden hızla gelebilme yeteneği.,"Toplumsal direnci artırmak, nüfusların iklim değişikliğinin etkilerine karşı koymasına yardımcı olmak için çok önemlidir."
412,misilleme,Yaralanma veya saldırıya karşı alınan önlem.,"Büyük ekonomiler arasında ticari misilleme, artan gümrük vergileri şeklinde yıkıcı bir döngüyü tetikleyebilir."
413,ayrımcılık,Toplumda grupların zorla birbirinden ayrılması.,Eğitim sistemlerindeki ırksal ayrımcılığın sosyal eşitlik üzerinde uzun süreli olumsuz etkileri vardır.
414,sosyoekonomik,Hem sosyal hem de ekonomik faktörlerle ilgili.,"Çocuğun sosyoekonomik geçmişi, eğitim başarısının en güçlü belirleyicilerinden biri olmaya devam etmektedir."
415,egemenlik,Devletin en yüksek otoritesi ve bağımsızlığı.,Uluslararası anlaşmalar bazen ülkelerin tam ekonomik egemenliklerini koruma arzusuyla çelişebilir.
416,sübvansiyon,Devlet fonlarıyla mali olarak desteklemek.,"Birçok hükümet, yenilenebilir enerjiyi fosil yakıtlarla daha rekabetçi hale getirmek için sübvansiyon sağlıyor."
417,hassas,Bir şeyden etkilenme veya bir şeye karşı savunmasız olma olasılığı yüksek.,"Yaşlı nüfus, solunum yolu enfeksiyon hastalıklarından kaynaklanan ciddi hastalıklara karşı özellikle hassastır."
418,sistemik,"Bir sistemin tamamına ilişkin, tek bir parçasına değil.","Yoksullukla mücadele, bireysel belirtileri hedef alan parça parça müdahalelerden ziyade sistemik bir değişim gerektirir."
419,yeniden formüle et,Yeni bir biçimde tekrar ifade etmek veya tasarlamak.,"Yeni kanıtlar ışığında, hükümetlerin halk sağlığı politikasına yaklaşımlarını yeniden gözden geçirmeleri gerekebilir."
420,kasılma,Ekonomik üretimde veya faaliyette azalma.,"Pandemi sırasında küresel ticarette yaşanan sert daralma, tedarik zincirlerinin kırılganlığını ortaya çıkardı."
421,sapma,Normal veya beklenenden sapma.,Bazı ekonomistler 2008 mali krizini piyasaların yapısal bir başarısızlığından ziyade bir sapma olarak değerlendiriyor.
422,tahttan feragat etmek,Bir görevi veya sorumluluğu yerine getirmemek.,"Kamu hizmetlerini kısıtlayan hükümetler, savunmasız vatandaşlara karşı sorumluluklarını yerine getirmemekle suçlanabilir."
423,sertlik,Konuşma veya davranış biçimindeki acımasız düşmanlık.,"Brexit müzakereleri, AB ve İngiltere temsilcileri arasında önemli ölçüde gerginlikle geçti."
424,birleştirmek,Tek bir cisim halinde birleştirmek veya bir araya getirmek.,İdari verimliliği artırmak ve işletme maliyetlerini düşürmek amacıyla birkaç küçük departman birleştirildi.
425,düzeltmek,Kötü bir durumu daha iyi veya daha katlanılabilir hale getirmek.,"Uluslararası yardım programları, çatışma bölgelerindeki yerinden edilmiş nüfusun karşılaştığı koşulları iyileştirmeyi amaçlamaktadır."
426,anakronizm,Tarihsel dönemine göre yersiz bir şey.,"Eleştirmenler, seçilmemiş üst meclisin modern toplumda demokratik bir anakronizm haline geldiğini savunuyor."
427,asimetri,Parçalar arasında eşitlik veya denklik eksikliği.,"Alıcılar ve satıcılar arasındaki bilgi asimetrisi, piyasa başarısızlıklarına ve verimsiz sonuçlara yol açabilir."
428,yıpranma,Sürekli basınç veya kayıp yoluyla kademeli azalma.,"Uzun süren çatışma, her iki tarafın da kaynaklarını tüketen bir yıpratma savaşına dönüştü."
429,çatallanma,İki kola veya bölüme ayrılma.,"Artan eşitsizlik, toplumu giderek birbirinden kopuk iki ekonomik gruba ayırmıştır."
430,atlatmak,Bir kuralı veya engeli aşmanın bir yolunu bulmak.,"Çokuluslu şirketler, yurt içi vergi yükümlülüklerinden kaçınmak için denizaşırı hesaplar kullanmakla suçlanıyor."
431,zorlayıcı,Eylemi zorlamak için güç veya tehdit kullanmak.,"Siyasi muhalefeti bastırmak için baskıcı önlemlerin kullanılması, temel demokratik ilkeleri ihlal eder."
432,metalaştırma,Bir şeyi pazarlanabilir bir mal olarak ele alma süreci.,"Yükseköğretimin ticarileşmesi, üniversiteleri kamu kurumları olmaktan çıkarıp ticari işletmelere dönüştürmüştür."
433,özgüven,Açıkça görünen tehlikelere rağmen duyulan tatmin duygusu.,"Artan eşitsizlik karşısında siyasi kayıtsızlık, toplumsal bölünmelerin önemli ölçüde derinleşmesine yol açmıştır."
434,varsayım,Yeterli kanıt olmadan oluşturulmuş bir görüş.,"Ampirik veriler olmadan, politikanın ekonomik etkisine ilişkin iddialar tamamen varsayımdan ibaret kalır."
