id,front,back,example
435,koşullu,Belirsiz koşullara veya durumlara bağlıdır.,"Reform programının başarısı, sürdürülebilir siyasi kararlılığa ve yeterli finansmana bağlıdır."
436,doğrulamak,Kanıtlarla doğrulamak veya desteklemek.,"Birden fazla bağımsız çalışma, hava kirliliğinin ölüm oranlarını önemli ölçüde artırdığı bulgusunu doğrulamaktadır."
437,kısaltmak,Bir şeyi önemli ölçüde azaltmak veya kısıtlamak.,Ulusal sağlık krizinin en yoğun olduğu dönemde sivil özgürlükleri kısıtlamak amacıyla acil durum yasaları çıkarıldı.
438,sınırlandırmak,Kesin ve net bir şekilde tanımlamak veya belirtmek.,"Uluslararası antlaşmalar, imzalayan her ülkenin sorumluluklarını açıkça belirtmelidir."
439,demografik temettü,Çalışma çağındaki nüfusun artmasından kaynaklanan ekonomik büyüme.,"Sahra Altı Afrika, eğitime yatırım yaparak demografik avantajından yararlanma fırsatına sahip."
440,caydırmak,Korku veya şüphe yoluyla eylemden caydırmak.,"Çevre ihlallerine yönelik daha ağır cezalar, şirketlerin su yollarını yasadışı bir şekilde kirletmelerini engelleyebilir."
441,ikilik,İki zıt kategoriye keskin bir ayrım.,"Ekonomik büyüme ve çevre koruma arasındaki ikilem, çoğu zaman yanlış bir seçim olarak sunulmaktadır."
442,difüzyon,Bir şeyin geniş bir alana yayılması.,"Dijital teknolojinin hızla yayılması, bilginin küresel ölçekte üretilme ve tüketilme biçimini dönüştürdü."
443,oy hakkından mahrum bırakmak,Birini haklarından veya ayrıcalıklarından mahrum etmek.,"Karmaşık seçmen kayıt şartları, düşük gelirli ve azınlık topluluklarını orantısız bir şekilde oy kullanma hakkından mahrum bırakabilir."
444,farklı,Özünde tür olarak farklı; karşılaştırılabilir değil.,"Politika, ekonomik koşulları çok farklı olan çeşitli toplulukların ihtiyaçlarını karşılamalıdır."
445,etkinlik,İstenilen sonucu elde etme yeteneği.,"Yeni tedavilerin halkın kullanımına onaylanmadan önce, klinik denemelerde etkinlikleri titizlikle test edilmelidir."
446,eşitlikçi,Herkese eşit haklar tanınmasına inanmak veya bunu savunmak.,"Gerçek anlamda eşitlikçi bir toplum, hem biçimsel yasal eşitliği hem de fırsat eşitliğinin özünü ele almalıdır."
447,yerleşik,Yerleşik ve değiştirilmesi zor.,"İşe alım uygulamalarındaki köklü cinsiyet ayrımcılığı, kadınları üst düzey pozisyonlarda dezavantajlı duruma düşürmeye devam ediyor."
448,denge,Karşıt güçler arasında bir denge durumu.,"Arz ve talep teorisine göre, piyasalar zaman içinde doğal olarak fiyat dengesine doğru eğilim gösterecektir."
449,ortadan kaldırmak,Bir şeyi tamamen yok etmek veya ortadan kaldırmak.,"Dünya Sağlık Örgütü'nün küresel çapta çocuk felcini ortadan kaldırma hedefi, evrensel aşılama kapsamını gerektiriyor."
450,ekstrapolasyon,Bilinen verileri kullanarak bilinmeyen durumları tahmin etmek.,"Araştırmacılar, küçük örneklemlerden elde edilen bulguları tüm popülasyonlara genellemeye çalışırken dikkatli olmalıdırlar."
451,imal etmek,Yanlış bilgi uydurmak; üretmek.,"Delil uyduran gazeteciler, medyaya olan kamu güvenini zedeliyor ve demokratik söyleme zarar veriyor."
452,fizibilite,Mümkün ve pratik olma niteliği.,Büyük ölçekli altyapı projelerinin onaylanmasından önce kapsamlı bir fizibilite çalışması yapılması gerekmektedir.
453,mali açık,Devlet harcamaları gelirlerini aştığında.,"Artan bütçe açığı, hükümetleri ya vergileri artırmaya ya da temel kamu harcamalarını kısmaya zorluyor."
454,çığır açan,Yenilikçi ve öncü; yeni fikirler sunan.,"Gen düzenleme alanındaki çığır açan araştırmalar, kalıtsal hastalıkların tedavisinde yeni olanaklar açmıştır."
455,bütünsel,"Sistemin parçalarını değil, tamamını ele almak.","Halk sağlığına yönelik bütüncül bir yaklaşım, sosyal, ekonomik ve çevresel belirleyicileri eş zamanlı olarak ele almalıdır."
456,homojen,Benzer veya tek tip unsurlardan oluşan.,"Giderek homojenleşen kent kültürleri, geleneksel yerel toplulukların zengin çeşitliliğini aşındırabilir."
457,engellemek,İlerlemeyi veya hareketi engellemek veya sekteye uğratmak.,Yolsuz bürokratik uygulamalar ekonomik kalkınmayı engeller ve doğrudan yabancı yatırımları caydırır.
458,yeni başlayan,Oluşmaya veya gelişmeye başlamış; erken aşamalarda.,Başlangıç ​​aşamasındaki ekonomik gerilemenin tam bir durgunluğa dönüşmesini önlemek için erken müdahale çok önemlidir.
459,ayrım gözetmeksizin,Dikkatli bir değerlendirme yapılmadan; rastgele ve özensizce yapılmış.,"Pestisitlerin ayrım gözetmeksizin kullanılması, ekosistemlere zarar verir ve hedeflenen türlerin çok ötesindeki türlere de olumsuz etkilerde bulunur."
460,doğuştan,Daimi ve temel bir özellik olarak var olmak.,Ekonomik büyümeyi en üst düzeye çıkarmak ile doğal çevreyi korumak arasında doğal bir gerilim söz konusudur.
461,kışkırtmak,Bir eylemi veya olayı başlatmak veya meydana getirmek.,Sivil toplum grupları genellikle hükümet kurumları üzerinde kamuoyu baskısı oluşturarak politika değişikliğini tetiklerler.
462,hafifletmek,Bir şeyin şiddetini veya etkisini azaltmak.,"Şehirlerde ağaç dikmek, yoğun nüfuslu şehirlerdeki ısı adası etkisini azaltmaya yardımcı olabilir."
463,sürdürmek,Bir şeyin süresiz olarak devam etmesini sağlamak.,"Mevcut sınıf yapılarını yansıtan eğitim sistemleri, sosyal eşitsizliği azaltmaktan ziyade pekiştirme eğilimindedir."
464,pragmatik,"Sorunlara teorik değil, pratik bir şekilde yaklaşmak.","Göç politikasına pragmatik bir yaklaşım, insani yükümlülükleri gerçekçi sosyal kapasiteyle dengeler."
465,tehlikeli,Belirsiz ve muhtemelen kötüleşecek; istikrarsız.,"Sıfır saatlik sözleşmelerin yaygınlaşması, birçok işçiyi mali açıdan riskli ve güvencesiz bir duruma düşürdü."
466,önleyici,Beklenen bir olayı önlemek için önceden harekete geçmek.,"Bazı hükümetler, yakın bir güvenlik tehdidiyle karşı karşıya kalındığında önleyici askeri harekatın haklı olduğunu savunmaktadır."
467,yankı,Bir olayın veya eylemin dolaylı sonucu.,"Ticaret savaşları, doğrudan dahil olan ülkelerin çok ötesindeki ülkeler için de ciddi ekonomik sonuçlar doğurabilir."
468,sıkı,"Sıkı, hassas ve zorlu uyumluluk.",Şirketlerin kirlilik maliyetlerini dış kaynaklara yüklemesini önlemek için sıkı çevre düzenlemeleri gereklidir.
469,baltalamak,Bir şeyi yavaş yavaş zayıflatmak veya zarar vermek.,"Yaygın yolsuzluk, halkın demokratik kurumlara ve hukukun üstünlüğüne olan güvenini zedeliyor."
470,yeniden kalibre et,Yeni koşullara yanıt olarak ayarlamak veya sıfırlamak.,"Hükümetler, hızla değişen küresel piyasa koşullarına yanıt olarak ekonomik politikalarını yeniden düzenlemek zorunda kalabilirler."
471,kültürel uyum,Başka bir gruba ait kültürel özellikleri benimsemek.,"Göçmen topluluklarının kültürel uyum süreci, miras ve ev sahibi kültürün normları arasında karmaşık bir müzakereyi içerir."
472,yargılamak,Resmi bir karar veya hüküm vermek.,"Uluslararası mahkemeler, ülkeler arasında ikili yollarla çözülemeyen anlaşmazlıkları karara bağlamak için vardır."
473,zıt,Bir şeye doğrudan zıt veya onunla çelişkili.,"Konuşma özgürlüğünün bastırılması, liberal demokratik yönetimin temel ilkelerine aykırıdır."
474,gelişmekte olan,Hızlı ve güçlü bir şekilde büyüyen veya gelişen.,"Güneydoğu Asya'da hızla büyüyen orta sınıf, tüketici talebinde benzeri görülmemiş bir artışa yol açıyor."
475,birleşmek,Bir araya gelerek tek bir bütün oluşturmak.,"Birbirinden farklı aktivist gruplar, çevresel ve sosyal adalet konusunda ortak bir gündem etrafında birleşmeye başladılar."
476,bilinçli,Bir şey hakkında bilgi sahibi olmak veya farkında olmak.,"Politika yapıcılar, sanayi gelişiminin uzun vadeli çevresel sonuçlarının tam olarak farkında olmalıdır."
477,ters etki,İstenilen etkinin tam tersini yaratmak.,"Aşırı cezalandırıcı uyuşturucu politikaları, madde bağımlılığını azaltmak yerine suç oranını artırarak ters etki yaratabilir."
478,döngüsel,Tekrarlanan bir dizi aracılığıyla düzenli olarak tekrar eden.,Yoksulluk genellikle döngüseldir ve yetersiz eğitim ve fırsatlara erişim nedeniyle nesilden nesile aktarılır.
479,demagoji,Popülist duygusal çağrılar yoluyla siyasi manipülasyon.,"Demokratik toplumlarda demagojinin yükselişi, rasyonel ve kanıta dayalı yönetişim için ciddi bir tehdit oluşturmaktadır."
480,endemik,Belirli bir bölgede düzenli olarak bulunan ve yaygın olan.,"Kamu kurumlarındaki yaygın yolsuzluk, ihtiyaç sahibi vatandaşlara etkili hizmet sunulmasını engelliyor."
481,epistemik,Bilgiyle veya bilginin doğrulanma derecesiyle ilgili.,"Bilgiye dayalı alçakgönüllülük, kamu politikası oluştururken neleri bilebileceğimizin sınırlarını kabul etmeyi gerektirir."
482,acil,Acil müdahale veya dikkat gerektiren; acil.,"Mülteci krizinin acil talepleri, acil ve koordineli bir uluslararası müdahale gerektiriyordu."
483,sınır ötesi,Bölgesel sınırların ötesine uzanan veya bu sınırların ötesinde faaliyet gösteren.,"Bazı ülkeler, yurt dışında işlenen rüşvet suçları nedeniyle şirketleri yargılamak için uluslararası hukuk kurallarını uygulamaktadır."
484,jeopolitik,Coğrafyanın etkilediği siyasetle ilgili.,"Kritik öneme sahip mineral kaynakları için yaşanan rekabet, büyük güçler arasındaki jeopolitik gerilimleri giderek artırıyor."
485,heterojen,Çeşitli nitelikte veya farklı unsurlardan oluşmuş.,"Çeşitli bakış açılarına sahip heterojen bir iş gücü, daha büyük kurumsal inovasyonu teşvik edebilir."
486,sezgisel,Deneme yanılma ve pratik yöntemler yoluyla keşfi mümkün kılmak.,"Davranışsal iktisat, bilişsel sezgisel yöntemlerin bireyleri sistematik olarak mantıksız kararlar almaya nasıl yönlendirebileceğini ortaya koymaktadır."
487,melezleme,İki farklı elementi birleştirme süreci.,"Küreselleşmiş şehirlerdeki kültürel melezleşme, birden fazla gelenekten beslenen yeni yaratıcı biçimler ortaya çıkarıyor."
488,değişmez,Zaman içinde değişmez; değiştirilmesi imkansızdır.,"Bazı filozoflar ahlaki gerçeklerin değişmez olduğunu savunurken, diğerleri bunların toplumla birlikte evrim geçirdiğini ileri sürer."
489,amansız,Durdurulması veya önlenmesi imkansız; amansız.,"Deniz seviyesinin amansız yükselişi, dünya genelindeki alçak kıyı toplulukları için varoluşsal bir tehdit oluşturmaktadır."
490,sinsi,"Yavaş yavaş, sinsice ve gizli bir şekilde zarar verir.","Bilinçsiz önyargı, işe alım kararları üzerinde sinsi bir etkiye sahip olabilir ve iş yerindeki sistemik eşitsizliği sürdürebilir."
491,inatçı,"Yönetilmesi, çözülmesi veya ele alınması çok zor.","İsrail-Filistin çatışması, on yıllarca süren uluslararası diplomatik çabalara rağmen çözümsüz kalmıştır."
492,çok yönlü,Birçok farklı yönü veya boyutu olan.,"İklim değişikliğiyle mücadele, teknolojik, politik ve davranışsal değişiklikleri birleştiren çok yönlü bir yaklaşım gerektirir."
493,yeni başlayan,Henüz var olmaya veya gelişmeye yeni başlamış.,"Yenilenebilir enerji sektörüne yapılan yatırımlar, ülkelerin fosil yakıtlara olan bağımlılıktan kurtulmasına yardımcı olabilir."
494,normatif,Davranış standartlarıyla ilgili veya bu standartları belirleyen.,"Cinsiyet rolleri hakkındaki normatif varsayımlar, eğitim ve iş yeri politikalarının tasarımını önemli ölçüde etkileyebilir."
495,gizlemek,Bir şeyi belirsiz veya anlaşılması zor hale getirmek.,Siyasetçiler bazen halktan hoşlanmadıkları kararları gizlemek için teknik terimler kullanırlar.
496,paradoksal,Görünüşte çelişkili ama muhtemelen doğru.,Bilgiye erişimin artmasının her zaman kamuoyunun siyasi katılımının artmasına yol açmaması paradoksal bir durumdur.
497,simbiyotik,İki taraf arasında karşılıklı fayda sağlamayı içerir.,"Üniversiteler ve sanayi arasındaki karşılıklı bağımlılık ilişkisi, inovasyonu ve ekonomik rekabet gücünü artırır."
498,geçici,Kısa süreliğine süren; geçici.,Emtia ihracatına dayalı ekonomik patlamalar genellikle geçicidir ve kalıcı kalkınma yaratmakta başarısız olur.
499,her yerde bulunan,Aynı anda her yerde mevcut ve bulunuyor.,"Akıllı telefonlar o kadar yaygınlaştı ki, dijital dışlanma artık ciddi bir sosyal dezavantaj biçimi olarak kabul ediliyor."
500,hegemonik,Başkaları üzerinde egemen güç sahibi olmakla ilgili.,"Eleştirmenler, hegemonik Batı kültürel normlarının genellikle küresel kurumlar aracılığıyla gelişmekte olan ülkelere dayatıldığını savunuyor."